[
  {
    "id": "R;2015-02-23;1",
    "rosterChangeType": "R",
    "rosterChangeTypeDesc": "RDO",
    "dateAppliedFor": "2015-02-23",
    "status": "Approved"
  },
  {
    "id": "R;2015-02-25;1",
    "rosterChangeType": "R",
    "rosterChangeTypeDesc": "RDO",
    "dateAppliedFor": "2015-02-25",
    "status": "Approved"
  }  
]